<?xml version="1.0"?>
<!DOCTYPE template SYSTEM "template.dtd">
<template name="programmasites" layout="default" description="voorpagina met als hoofd item een magazine">
  <component name="page_head"/>
  <component name="logo"/>
  <component name="navigation"/>
  <container name="horizontal" layout="horizontal">
    <component name="home_maps"/>
    <container name="vertical">
      <component name="home_superteaser"/>
      <component name="home_magazine"/>
    </container>
    <component name="home_related_episodes"/>
  </container>
</template>
