<?xml version="1.0"?>
<!DOCTYPE template SYSTEM "template.dtd">
<template name="default" layout="default">
  <component name="page_head"/>
  <component name="navigation">
    <property name="showBinders">flase</property>
    <property name="showArchives">flase</property>
    <property name="showForums">flase</property>
    <property name="showLogs">flase</property>
  </component>
  <container name="horizontal" layout="horizontal">
     <component name="item_siblings"/>
    <container name="vertical">
            <component name="item_title"/>
            <component name="item_nav"/>
            <component name="item_body"/>
    </container>
    <component name="item_related_audio_video"/>
  </container>
</template>
