<?xml version="1.0"?>
<!DOCTYPE template SYSTEM "template.dtd">
<template name="nocache" layout="default">
  <component name="page_head"/>
  <component name="navigation">
    <property name="showBinders">flase</property>
    <property name="showArchives">flase</property>
    <property name="showForums">flase</property>
    <property name="showLogs">flase</property>
  </component>
  <component name="search"/>
</template>
