<?xml version="1.0"?>
<!DOCTYPE template SYSTEM "template.dtd">
<template name="default" layout="default" description="pagina om een dossier te laten zien">
  <component name="page_head"/>
  <component name="logo"/>
  <component name="navigation"/>
  <container name="horizontal" layout="horizontal">
      <container name="vertical">
      	    <component name="breadcrum"/>
   	        <component name="binder"/>
     </container>
     <component name="binder_content"/>
     <component name="binder_related"/>
  </container>
</template>
