<?xml version="1.0"?>
<!DOCTYPE template SYSTEM "template.dtd">
<template name="default" layout="default" description="pagina om een news weer te geven">
  <component name="page_head"/>
  <component name="logo"/>
  <component name="navigation"/>
  <container name="horizontal" layout="horizontal">
    <container name="vertical">
	    <component name="related_images"/>
    </container>
    <container name="vertical">
        <component name="news_prev_next"/>
       <component name="news"/>
    </container>
    <component name="related_audio_video"/>
  </container>
</template>
