<?xml version="1.0"?>
<!DOCTYPE template SYSTEM "template.dtd">
<template name="default" layout="default" description="pagina om een aflevering te laten zien">
  <component name="page_head"/>
  <component name="logo"/>
  <component name="navigation"/>
  <container name="horizontal" layout="horizontal">
    <container name="vertical">
      <component name="episode_name"/>
      <component name="related_images"/>
    </container>
    <container name="vertical">
      <component name="episode_title"/>
      <component name="episode_previousnext"/>
      <component name="episode_body"/>
    </container>
    <component name="related_audio_video"/>
  </container>
</template>
